platform,topic,year,id,title,landing_url,pdf_url,final_url,status,file_path,error,source
arXiv,NL2SQL,2026,2602.21480v2,"Both Ends Count! Just How Good are LLM Agents at ""Text-to-Big SQL""?",https://arxiv.org/abs/2602.21480v2,https://arxiv.org/pdf/2602.21480v2,https://arxiv.org/pdf/2602.21480v2,downloaded,papers/arxiv/001-2602.21480v2-Both-Ends-Count-Just-How-Good-are-LLM-Agents-at-Text-to-Big-SQL.pdf,,arXiv API
arXiv,NL2SQL,2026,2602.17001v1,Sonar-TS: Search-Then-Verify Natural Language Querying for Time Series Databases,https://arxiv.org/abs/2602.17001v1,https://arxiv.org/pdf/2602.17001v1,https://arxiv.org/pdf/2602.17001v1,downloaded,papers/arxiv/002-2602.17001v1-Sonar-TS-Search-Then-Verify-Natural-Language-Querying-for-Time-Series.pdf,,arXiv API
arXiv,NL2SQL,2026,2602.15564v1,Beyond Static Pipelines: Learning Dynamic Workflows for Text-to-SQL,https://arxiv.org/abs/2602.15564v1,https://arxiv.org/pdf/2602.15564v1,https://arxiv.org/pdf/2602.15564v1,downloaded,papers/arxiv/003-2602.15564v1-Beyond-Static-Pipelines-Learning-Dynamic-Workflows-for-Text-to-SQL.pdf,,arXiv API
arXiv,NL2SQL,2026,2602.14612v2,LongAudio-RAG: Event-Grounded Question Answering over Multi-Hour Long Audio,https://arxiv.org/abs/2602.14612v2,https://arxiv.org/pdf/2602.14612v2,https://arxiv.org/pdf/2602.14612v2,downloaded,papers/arxiv/004-2602.14612v2-LongAudio-RAG-Event-Grounded-Question-Answering-over-Multi-Hour-Long-A.pdf,,arXiv API
arXiv,NL2SQL,2026,2602.18492v1,Vibe Coding on Trial: Operating Characteristics of Unanimous LLM Juries,https://arxiv.org/abs/2602.18492v1,https://arxiv.org/pdf/2602.18492v1,https://arxiv.org/pdf/2602.18492v1,downloaded,papers/arxiv/005-2602.18492v1-Vibe-Coding-on-Trial-Operating-Characteristics-of-Unanimous-LLM-Juries.pdf,,arXiv API
arXiv,NL2SQL,2026,2602.12064v1,DIVER: A Robust Text-to-SQL System with Dynamic Interactive Value Linking and Evidence Reasoning,https://arxiv.org/abs/2602.12064v1,https://arxiv.org/pdf/2602.12064v1,https://arxiv.org/pdf/2602.12064v1,downloaded,papers/arxiv/006-2602.12064v1-DIVER-A-Robust-Text-to-SQL-System-with-Dynamic-Interactive-Value-Linki.pdf,,arXiv API
arXiv,NL2SQL,2026,2602.12015v1,Disentangling Ambiguity from Instability in Large Language Models: A Clinical Text-to-SQL Case Study,https://arxiv.org/abs/2602.12015v1,https://arxiv.org/pdf/2602.12015v1,https://arxiv.org/pdf/2602.12015v1,downloaded,papers/arxiv/007-2602.12015v1-Disentangling-Ambiguity-from-Instability-in-Large-Language-Models-A-Cl.pdf,,arXiv API
arXiv,NL2SQL,2026,2602.16720v1,APEX-SQL: Talking to the data via Agentic Exploration for Text-to-SQL,https://arxiv.org/abs/2602.16720v1,https://arxiv.org/pdf/2602.16720v1,https://arxiv.org/pdf/2602.16720v1,downloaded,papers/arxiv/008-2602.16720v1-APEX-SQL-Talking-to-the-data-via-Agentic-Exploration-for-Text-to-SQL.pdf,,arXiv API
arXiv,NL2SQL,2026,2602.05385v1,IESR:Efficient MCTS-Based Modular Reasoning for Text-to-SQL with Large Language Models,https://arxiv.org/abs/2602.05385v1,https://arxiv.org/pdf/2602.05385v1,https://arxiv.org/pdf/2602.05385v1,downloaded,papers/arxiv/009-2602.05385v1-IESREfficient-MCTS-Based-Modular-Reasoning-for-Text-to-SQL-with-Large.pdf,,arXiv API
arXiv,NL2SQL,2026,2602.03633v1,BIRDTurk: Adaptation of the BIRD Text-to-SQL Dataset to Turkish,https://arxiv.org/abs/2602.03633v1,https://arxiv.org/pdf/2602.03633v1,https://arxiv.org/pdf/2602.03633v1,downloaded,papers/arxiv/010-2602.03633v1-BIRDTurk-Adaptation-of-the-BIRD-Text-to-SQL-Dataset-to-Turkish.pdf,,arXiv API
arXiv,NL2SQL,2026,2602.07034v1,ST-Raptor: An Agentic System for Semi-Structured Table QA,https://arxiv.org/abs/2602.07034v1,https://arxiv.org/pdf/2602.07034v1,https://arxiv.org/pdf/2602.07034v1,downloaded,papers/arxiv/011-2602.07034v1-ST-Raptor-An-Agentic-System-for-Semi-Structured-Table-QA.pdf,,arXiv API
arXiv,NL2SQL,2026,2602.01355v2,Aggregation Queries over Unstructured Text: Benchmark and Agentic Method,https://arxiv.org/abs/2602.01355v2,https://arxiv.org/pdf/2602.01355v2,https://arxiv.org/pdf/2602.01355v2,downloaded,papers/arxiv/012-2602.01355v2-Aggregation-Queries-over-Unstructured-Text-Benchmark-and-Agentic-Metho.pdf,,arXiv API
arXiv,NL2SQL,2026,2601.18119v1,Beyond Text-to-SQL: Can LLMs Really Debug Enterprise ETL SQL?,https://arxiv.org/abs/2601.18119v1,https://arxiv.org/pdf/2601.18119v1,https://arxiv.org/pdf/2601.18119v1,downloaded,papers/arxiv/013-2601.18119v1-Beyond-Text-to-SQL-Can-LLMs-Really-Debug-Enterprise-ETL-SQL.pdf,,arXiv API
arXiv,NL2SQL,2026,2601.17942v1,"LLM-Based SQL Generation: Prompting, Self-Refinement, and Adaptive Weighted Majority Voting",https://arxiv.org/abs/2601.17942v1,https://arxiv.org/pdf/2601.17942v1,https://arxiv.org/pdf/2601.17942v1,downloaded,papers/arxiv/014-2601.17942v1-LLM-Based-SQL-Generation-Prompting-Self-Refinement-and-Adaptive-Weight.pdf,,arXiv API
arXiv,NL2SQL,2026,2601.17699v1,SQL-Trail: Multi-Turn Reinforcement Learning with Interleaved Feedback for Text-to-SQL,https://arxiv.org/abs/2601.17699v1,https://arxiv.org/pdf/2601.17699v1,https://arxiv.org/pdf/2601.17699v1,downloaded,papers/arxiv/015-2601.17699v1-SQL-Trail-Multi-Turn-Reinforcement-Learning-with-Interleaved-Feedback.pdf,,arXiv API
arXiv,NL2SQL,2026,2601.15728v2,Benchmarking Text-to-Python against Text-to-SQL: The Impact of Explicit Logic and Ambiguity,https://arxiv.org/abs/2601.15728v2,https://arxiv.org/pdf/2601.15728v2,https://arxiv.org/pdf/2601.15728v2,downloaded,papers/arxiv/016-2601.15728v2-Benchmarking-Text-to-Python-against-Text-to-SQL-The-Impact-of-Explicit.pdf,,arXiv API
arXiv,NL2SQL,2026,2601.15709v1,AgentSM: Semantic Memory for Agentic Text-to-SQL,https://arxiv.org/abs/2601.15709v1,https://arxiv.org/pdf/2601.15709v1,https://arxiv.org/pdf/2601.15709v1,downloaded,papers/arxiv/017-2601.15709v1-AgentSM-Semantic-Memory-for-Agentic-Text-to-SQL.pdf,,arXiv API
arXiv,NL2SQL,2026,2601.14518v1,Business Logic-Driven Text-to-SQL Data Synthesis for Business Intelligence,https://arxiv.org/abs/2601.14518v1,https://arxiv.org/pdf/2601.14518v1,https://arxiv.org/pdf/2601.14518v1,downloaded,papers/arxiv/018-2601.14518v1-Business-Logic-Driven-Text-to-SQL-Data-Synthesis-for-Business-Intellig.pdf,,arXiv API
arXiv,NL2SQL,2026,2601.13695v2,OptiSQL: Executable SQL Generation from Optical Tokens,https://arxiv.org/abs/2601.13695v2,https://arxiv.org/pdf/2601.13695v2,https://arxiv.org/pdf/2601.13695v2,downloaded,papers/arxiv/019-2601.13695v2-OptiSQL-Executable-SQL-Generation-from-Optical-Tokens.pdf,,arXiv API
arXiv,NL2SQL,2026,2601.13111v1,CORE-T: COherent REtrieval of Tables for Text-to-SQL,https://arxiv.org/abs/2601.13111v1,https://arxiv.org/pdf/2601.13111v1,https://arxiv.org/pdf/2601.13111v1,downloaded,papers/arxiv/020-2601.13111v1-CORE-T-COherent-REtrieval-of-Tables-for-Text-to-SQL.pdf,,arXiv API
arXiv,NL2SQL,2026,2601.10398v2,LatentRefusal: Latent-Signal Refusal for Unanswerable Text-to-SQL Queries,https://arxiv.org/abs/2601.10398v2,https://arxiv.org/pdf/2601.10398v2,https://arxiv.org/pdf/2601.10398v2,downloaded,papers/arxiv/021-2601.10398v2-LatentRefusal-Latent-Signal-Refusal-for-Unanswerable-Text-to-SQL-Queri.pdf,,arXiv API
arXiv,NL2SQL,2026,2601.09876v1,Patient-Similarity Cohort Reasoning in Clinical Text-to-SQL,https://arxiv.org/abs/2601.09876v1,https://arxiv.org/pdf/2601.09876v1,https://arxiv.org/pdf/2601.09876v1,downloaded,papers/arxiv/022-2601.09876v1-Patient-Similarity-Cohort-Reasoning-in-Clinical-Text-to-SQL.pdf,,arXiv API
arXiv,NL2SQL,2026,2601.09404v1,TiInsight: A SQL-based Automated Exploratory Data Analysis System through Large Language Models,https://arxiv.org/abs/2601.09404v1,https://arxiv.org/pdf/2601.09404v1,https://arxiv.org/pdf/2601.09404v1,downloaded,papers/arxiv/023-2601.09404v1-TiInsight-A-SQL-based-Automated-Exploratory-Data-Analysis-System-throu.pdf,,arXiv API
arXiv,NL2SQL,2026,2601.08778v3,Pervasive Annotation Errors Break Text-to-SQL Benchmarks and Leaderboards,https://arxiv.org/abs/2601.08778v3,https://arxiv.org/pdf/2601.08778v3,https://arxiv.org/pdf/2601.08778v3,downloaded,papers/arxiv/024-2601.08778v3-Pervasive-Annotation-Errors-Break-Text-to-SQL-Benchmarks-and-Leaderboa.pdf,,arXiv API
arXiv,NL2SQL,2026,2601.08743v1,TableCache: Primary Foreign Key Guided KV Cache Precomputation for Low Latency Text-to-SQL,https://arxiv.org/abs/2601.08743v1,https://arxiv.org/pdf/2601.08743v1,https://arxiv.org/pdf/2601.08743v1,downloaded,papers/arxiv/025-2601.08743v1-TableCache-Primary-Foreign-Key-Guided-KV-Cache-Precomputation-for-Low.pdf,,arXiv API
arXiv,NL2SQL,2026,2601.06678v1,Reflective Reasoning for SQL Generation,https://arxiv.org/abs/2601.06678v1,https://arxiv.org/pdf/2601.06678v1,https://arxiv.org/pdf/2601.06678v1,downloaded,papers/arxiv/026-2601.06678v1-Reflective-Reasoning-for-SQL-Generation.pdf,,arXiv API
arXiv,NL2SQL,2026,2601.06564v1,CSR-RAG: An Efficient Retrieval System for Text-to-SQL on the Enterprise Scale,https://arxiv.org/abs/2601.06564v1,https://arxiv.org/pdf/2601.06564v1,https://arxiv.org/pdf/2601.06564v1,downloaded,papers/arxiv/027-2601.06564v1-CSR-RAG-An-Efficient-Retrieval-System-for-Text-to-SQL-on-the-Enterpris.pdf,,arXiv API
arXiv,NL2SQL,2026,2601.05451v1,RingSQL: Generating Synthetic Data with Schema-Independent Templates for Text-to-SQL Reasoning Models,https://arxiv.org/abs/2601.05451v1,https://arxiv.org/pdf/2601.05451v1,https://arxiv.org/pdf/2601.05451v1,downloaded,papers/arxiv/028-2601.05451v1-RingSQL-Generating-Synthetic-Data-with-Schema-Independent-Templates-fo.pdf,,arXiv API
arXiv,NL2SQL,2026,2601.04875v1,EvolSQL: Structure-Aware Evolution for Scalable Text-to-SQL Data Synthesis,https://arxiv.org/abs/2601.04875v1,https://arxiv.org/pdf/2601.04875v1,https://arxiv.org/pdf/2601.04875v1,downloaded,papers/arxiv/029-2601.04875v1-EvolSQL-Structure-Aware-Evolution-for-Scalable-Text-to-SQL-Data-Synthe.pdf,,arXiv API
arXiv,NL2SQL,2026,2601.01126v2,RoboPhD: Self-Improving Text-to-SQL Through Autonomous Agent Evolution,https://arxiv.org/abs/2601.01126v2,https://arxiv.org/pdf/2601.01126v2,https://arxiv.org/pdf/2601.01126v2,downloaded,papers/arxiv/030-2601.01126v2-RoboPhD-Self-Improving-Text-to-SQL-Through-Autonomous-Agent-Evolution.pdf,,arXiv API
Research Square,知识图谱,2026,10.21203/rs.3.rs-8404311/v1,Construction of Personal Health Knowledge Graphs for Clinical Data Harmonization in Breast Cancer,https://doi.org/10.21203/rs.3.rs-8404311/v1,https://www.researchsquare.com/article/rs-8404311/latest.pdf,https://assets-eu.researchsquare.com/files/rs-8404311/v1/dda3d6c6-8322-4c20-8673-790367a6d82a.pdf?c=1770719317,downloaded,papers/research-square/031-10.21203_rs.3.rs-8404311_v1-Construction-of-Personal-Health-Knowledge-Graphs-for-Clinical-Data-Har.pdf,,OpenAlex
Research Square,数据治理,2026,10.21203/rs.3.rs-7958332/v1,Decoding Contractual Architectures: Industrial Practices in Agricultural Data Governance Reveal Systemic Derivative Inequities,https://doi.org/10.21203/rs.3.rs-7958332/v1,https://www.researchsquare.com/article/rs-7958332/latest.pdf,https://assets-eu.researchsquare.com/files/rs-7958332/v1/73635ff1-d9d6-485f-9dfa-0ef85b0d9bd8.pdf?c=1772194995,downloaded,papers/research-square/032-10.21203_rs.3.rs-7958332_v1-Decoding-Contractual-Architectures-Industrial-Practices-in-Agricultura.pdf,,OpenAlex
Research Square,数据治理,2026,10.21203/rs.3.rs-8734900/v1,"Data Governance for Sustainable AI in Organizations: A Benchmarkability-First Capability Model, Evidence Map, and Marketplace Microdata Demonstration",https://doi.org/10.21203/rs.3.rs-8734900/v1,https://www.researchsquare.com/article/rs-8734900/latest.pdf,https://assets-eu.researchsquare.com/files/rs-8734900/v1/7c7875c6-f431-49db-8bde-3abbbaa14156.pdf?c=1770717782,downloaded,papers/research-square/033-10.21203_rs.3.rs-8734900_v1-Data-Governance-for-Sustainable-AI-in-Organizations-A-Benchmarkability.pdf,,OpenAlex
Research Square,数据治理,2026,10.21203/rs.3.rs-8797649/v1,"The Five Ways Framework for AI Ethics in Healthcare: Integrating Core Ethical Principles, Blockchain Transparency, Autonomous Agents, Data Governance, and Digital Identity for Patient Privacy and Sovereignty",https://doi.org/10.21203/rs.3.rs-8797649/v1,https://www.researchsquare.com/article/rs-8797649/latest.pdf,https://assets-eu.researchsquare.com/files/rs-8797649/v1/2d9d59d9-650e-4531-b627-624609070931.pdf?c=1770721543,downloaded,papers/research-square/034-10.21203_rs.3.rs-8797649_v1-The-Five-Ways-Framework-for-AI-Ethics-in-Healthcare-Integrating-Core-E.pdf,,OpenAlex
Research Square,数据治理,2026,10.21203/rs.3.rs-8688204/v1,Reflexive digital twins and behavioral governance in data-driven systems,https://doi.org/10.21203/rs.3.rs-8688204/v1,https://www.researchsquare.com/article/rs-8688204/latest.pdf,https://assets-eu.researchsquare.com/files/rs-8688204/v1_covered_80bd3a58-83b3-445c-aa4e-51b86e272d4e.pdf?c=1770720737,downloaded,papers/research-square/035-10.21203_rs.3.rs-8688204_v1-Reflexive-digital-twins-and-behavioral-governance-in-data-driven-syste.pdf,,OpenAlex
Research Square,数据治理,2026,10.21203/rs.3.rs-8100262/v1,From data factors to new quality productivity: Spatial and governance pathways of China’s industrial transformation,https://doi.org/10.21203/rs.3.rs-8100262/v1,https://doi.org/10.21203/rs.3.rs-8100262/v1,,failed,,not_pdf content-type=text/html; charset=utf-8 final_url=https://www.researchsquare.com/article/rs-8100262/v1,OpenAlex
Research Square,NL2SQL,2025,10.21203/rs.3.rs-6444534/v1,The Effectiveness of Local Fine-Tuned LLMs: Assessment of the Japanese National Examination for Pharmacists,https://doi.org/10.21203/rs.3.rs-6444534/v1,https://www.researchsquare.com/article/rs-6444534/latest.pdf,https://assets-eu.researchsquare.com/files/rs-6444534/v1/84661db0-04d1-4328-91b9-f09d25d06c03.pdf?c=1744697024,downloaded,papers/research-square/036-10.21203_rs.3.rs-6444534_v1-The-Effectiveness-of-Local-Fine-Tuned-LLMs-Assessment-of-the-Japanese.pdf,,OpenAlex
Research Square,NL2SQL,2025,10.21203/rs.3.rs-6958223/v1,Infusing Syntax and Semantics into LLMs,https://doi.org/10.21203/rs.3.rs-6958223/v1,https://www.researchsquare.com/article/rs-6958223/latest.pdf,https://assets-eu.researchsquare.com/files/rs-6958223/v1_covered_b7f6c808-0d79-4099-b96d-0996755456cc.pdf?c=1752599460,downloaded,papers/research-square/037-10.21203_rs.3.rs-6958223_v1-Infusing-Syntax-and-Semantics-into-LLMs.pdf,,OpenAlex
Research Square,NL2SQL,2025,10.21203/rs.3.rs-7329922/v1,"A Review of IoT and Cloud Computing: Issues, Challenges, and Opportunities in Eutrophication Monitoring",https://doi.org/10.21203/rs.3.rs-7329922/v1,https://www.researchsquare.com/article/rs-7329922/latest.pdf,https://assets-eu.researchsquare.com/files/rs-7329922/v1/bfaee6fb-07c0-4f76-a9cd-0be08aec0e47.pdf?c=1754917717,downloaded,papers/research-square/038-10.21203_rs.3.rs-7329922_v1-A-Review-of-IoT-and-Cloud-Computing-Issues-Challenges-and-Opportunitie.pdf,,OpenAlex
Research Square,NL2SQL,2025,10.21203/rs.3.rs-6467790/v1,Grid CoPilot: A Large Language Model (LLM)based framework for Transforming Long-termPlanning Analyses,https://doi.org/10.21203/rs.3.rs-6467790/v1,https://www.researchsquare.com/article/rs-6467790/latest.pdf,https://assets-eu.researchsquare.com/files/rs-6467790/v1_covered_48ca7f7b-b665-40a9-a779-2b5568217b40.pdf?c=1744952437,downloaded,papers/research-square/039-10.21203_rs.3.rs-6467790_v1-Grid-CoPilot-A-Large-Language-Model-LLMbased-framework-for-Transformin.pdf,,OpenAlex
EarthArXiv,数据治理,2026,10.31223/x55f4z,"Implementing the Biodiversity Beyond National Jurisdiction (BBNJ) Agreement in a State Centric System: The Role of AI in Data Readiness, Corporate Traceability, and EIA Consistency in Areas Beyond National Jurisdiction (ABNJ)",https://doi.org/10.31223/x55f4z,https://eartharxiv.org/repository/object/11806/download/21276/,https://eartharxiv.org/repository/object/11806/download/21276/,downloaded,papers/eartharxiv/040-10.31223_x55f4z-Implementing-the-Biodiversity-Beyond-National-Jurisdiction-BBNJ-Agreem.pdf,,OpenAlex
EarthArXiv,数据治理,2026,10.31223/x5cv0f,A Scalable Borehole Thermometry Framework for Process-Based Monitoring of Near-Surface Thermal Dynamics Across Polar and High-Mountain Cryosphere Systems,https://doi.org/10.31223/x5cv0f,https://eartharxiv.org/repository/object/11937/download/21433/,https://eartharxiv.org/repository/object/11937/download/21433/,downloaded,papers/eartharxiv/041-10.31223_x5cv0f-A-Scalable-Borehole-Thermometry-Framework-for-Process-Based-Monitoring.pdf,,OpenAlex
EarthArXiv,数据治理,2026,10.31223/x51x9f,Who holds Brazil’s biodiversity? The pivotal role of private landholders,https://doi.org/10.31223/x51x9f,https://eartharxiv.org/repository/object/11616/download/20994/,https://eartharxiv.org/repository/object/11616/download/20994/,downloaded,papers/eartharxiv/042-10.31223_x51x9f-Who-holds-Brazils-biodiversity-The-pivotal-role-of-private-landholders.pdf,,OpenAlex
EarthArXiv,数据治理,2026,10.31223/x58j3j,What Companies Say vs. What Matters: LLM Analysis of Biodiversity Disclosures in Oil and Gas,https://doi.org/10.31223/x58j3j,https://eartharxiv.org/repository/object/11631/download/21013/,https://eartharxiv.org/repository/object/11631/download/21013/,downloaded,papers/eartharxiv/043-10.31223_x58j3j-What-Companies-Say-vs-What-Matters-LLM-Analysis-of-Biodiversity-Disclo.pdf,,OpenAlex
EarthArXiv,知识图谱,2025,10.31223/x5m157,Artificial Intelligence in Earth Science: A GeoAI Perspective,https://doi.org/10.31223/x5m157,https://eartharxiv.org/repository/object/9815/download/18253/,https://eartharxiv.org/repository/object/9815/download/18253/,downloaded,papers/eartharxiv/044-10.31223_x5m157-Artificial-Intelligence-in-Earth-Science-A-GeoAI-Perspective.pdf,,OpenAlex
IEEE(Open),NL2SQL,2025,10.1109/ijcnn64981.2025.11227320,HI-SQL: Optimizing Text-to-SQL Systems through Dynamic Hint Integration,http://arxiv.org/abs/2506.18916,https://arxiv.org/pdf/2506.18916,https://arxiv.org/pdf/2506.18916,downloaded,papers/ieee_open_/045-10.1109_ijcnn64981.2025.11227320-HI-SQL-Optimizing-Text-to-SQL-Systems-through-Dynamic-Hint-Integration.pdf,,OpenAlex
IEEE(Open),NL2SQL,2025,10.1109/icdew67478.2025.00005,SEED: Enhancing Text-to-SQL Performance and Practical Usability Through Automatic Evidence Generation,http://arxiv.org/abs/2506.07423,https://arxiv.org/pdf/2506.07423,https://arxiv.org/pdf/2506.07423,downloaded,papers/ieee_open_/046-10.1109_icdew67478.2025.00005-SEED-Enhancing-Text-to-SQL-Performance-and-Practical-Usability-Through.pdf,,OpenAlex
IEEE(Open),知识图谱,2025,10.1109/llm4code66737.2025.00026,Knowledge Graph Based Repository-Level Code Generation,http://arxiv.org/abs/2505.14394,https://arxiv.org/pdf/2505.14394,https://arxiv.org/pdf/2505.14394,downloaded,papers/ieee_open_/047-10.1109_llm4code66737.2025.00026-Knowledge-Graph-Based-Repository-Level-Code-Generation.pdf,,OpenAlex
IEEE(Open),知识图谱,2025,10.1109/cai64502.2025.00075,From Patient Consultations to Graphs: Leveraging LLMs for Patient Journey Knowledge Graph Construction,https://pmc.ncbi.nlm.nih.gov/articles/PMC12412408/,https://pmc.ncbi.nlm.nih.gov/articles/PMC12412408/,,failed,,not_pdf content-type=text/html; charset=utf-8 final_url=https://pmc.ncbi.nlm.nih.gov/articles/PMC12412408/,OpenAlex
IEEE(Open),知识图谱,2025,10.1109/mwc.2025.3600951,When Knowledge Graph Meets Retrieval Augmented Generation for Wireless Networks: A Tutorial and Case Study,https://pure.qub.ac.uk/en/publications/a7e970cb-6bec-42e6-8f85-4a089530e894,https://pure.qub.ac.uk/en/publications/a7e970cb-6bec-42e6-8f85-4a089530e894,,failed,,not_pdf content-type=text/html;charset=utf-8 final_url=https://pure.qub.ac.uk/en/publications/when-knowledge-graph-meets-retrieval-augmented-generation-for-wir/,OpenAlex
Research Square,text to sql,2025,10.21203/rs.3.rs-6493083/v1,Cost Optimization in Google BigQuery: Best Practices for Query Efficiency and Storage Management,https://doi.org/10.21203/rs.3.rs-6493083/v1,https://www.researchsquare.com/article/rs-6493083/latest.pdf,https://assets-eu.researchsquare.com/files/rs-6493083/v1_covered_f5e3124a-4345-4634-bbe2-0559d65461a9.pdf?c=1757440889,downloaded,papers/research-square/048-10.21203_rs.3.rs-6493083_v1-Cost-Optimization-in-Google-BigQuery-Best-Practices-for-Query-Efficien.pdf,,OpenAlex(topup)
IEEE(Open),text to sql,2024,10.1109/icmla61862.2024.00119,REFORMER: A ChatGPT-Driven Data Synthesis Framework Elevating Text-to-SQL Models,http://arxiv.org/abs/2504.04363,https://arxiv.org/pdf/2504.04363,https://arxiv.org/pdf/2504.04363,downloaded,papers/ieee_open_/049-10.1109_icmla61862.2024.00119-REFORMER-A-ChatGPT-Driven-Data-Synthesis-Framework-Elevating-Text-to-S.pdf,,OpenAlex(topup)
IEEE(Open),text to sql,2024,10.1109/tcad.2024.3387312,WAVING Goodbye to Manual Waveform Analysis in HDL Design With WAL,https://doi.org/10.1109/tcad.2024.3387312,https://ieeexplore.ieee.org/ielx7/43/6917053/10496480.pdf,https://ieeexplore.ieee.org/ielx7/43/6917053/10496480.pdf,downloaded,papers/ieee_open_/050-10.1109_tcad.2024.3387312-WAVING-Goodbye-to-Manual-Waveform-Analysis-in-HDL-Design-With-WAL.pdf,,OpenAlex(topup)
arXiv,NL2SQL,2023,2304.11015v3,DIN-SQL: Decomposed In-Context Learning of Text-to-SQL with Self-Correction,https://arxiv.org/abs/2304.11015v3,https://arxiv.org/pdf/2304.11015v3,https://arxiv.org/pdf/2304.11015v3,downloaded,papers/arxiv/051-2304.11015v3-DIN-SQL-Decomposed-In-Context-Learning-of-Text-to-SQL-with-Self-Correction.pdf,,arXiv(abs/pdf) route-supplement-20260303
arXiv,NL2SQL,2023,2310.17342v1,ACT-SQL: In-Context Learning for Text-to-SQL with Automatically-Generated Chain-of-Thought,https://arxiv.org/abs/2310.17342v1,https://arxiv.org/pdf/2310.17342v1,https://arxiv.org/pdf/2310.17342v1,downloaded,papers/arxiv/052-2310.17342v1-ACT-SQL-In-Context-Learning-for-Text-to-SQL-with-Automatically-Generated-Chain-of-Though.pdf,,arXiv(abs/pdf) route-supplement-20260303
arXiv,NL2SQL,2023,2308.02582v3,Adapt and Decompose: Efficient Generalization of Text-to-SQL via Domain Adapted Least-To-Most Prompting,https://arxiv.org/abs/2308.02582v3,https://arxiv.org/pdf/2308.02582v3,https://arxiv.org/pdf/2308.02582v3,downloaded,papers/arxiv/053-2308.02582v3-Adapt-and-Decompose-Efficient-Generalization-of-Text-to-SQL-via-Domain-Adapted-Least-To.pdf,,arXiv(abs/pdf) route-supplement-20260303
arXiv,NL2SQL,2024,2402.10671v3,Decomposition for Enhancing Attention: Improving LLM-based Text-to-SQL through Workflow Paradigm,https://arxiv.org/abs/2402.10671v3,https://arxiv.org/pdf/2402.10671v3,https://arxiv.org/pdf/2402.10671v3,downloaded,papers/arxiv/054-2402.10671v3-Decomposition-for-Enhancing-Attention-Improving-LLM-based-Text-to-SQL-through-Workflow-P.pdf,,arXiv(abs/pdf) route-supplement-20260303
arXiv,NL2SQL,2024,2403.20014v1,PURPLE: Making a Large Language Model a Better SQL Writer,https://arxiv.org/abs/2403.20014v1,https://arxiv.org/pdf/2403.20014v1,https://arxiv.org/pdf/2403.20014v1,downloaded,papers/arxiv/055-2403.20014v1-PURPLE-Making-a-Large-Language-Model-a-Better-SQL-Writer.pdf,,arXiv(abs/pdf) route-supplement-20260303
arXiv,NL2SQL,2023,2307.05074v2,Retrieval-augmented GPT-3.5-based Text-to-SQL Framework with Sample-aware Prompting and Dynamic Revision Chain,https://arxiv.org/abs/2307.05074v2,https://arxiv.org/pdf/2307.05074v2,https://arxiv.org/pdf/2307.05074v2,downloaded,papers/arxiv/056-2307.05074v2-Retrieval-augmented-GPT-35-based-Text-to-SQL-Framework-with-Sample-aware-Prompting-and-D.pdf,,arXiv(abs/pdf) route-supplement-20260303
arXiv,NL2SQL,2024,2405.16755v1,CHESS: Contextual Harnessing for Efficient SQL Synthesis,https://arxiv.org/abs/2405.16755v1,https://arxiv.org/pdf/2405.16755v1,https://arxiv.org/pdf/2405.16755v1,downloaded,papers/arxiv/057-2405.16755v1-CHESS-Contextual-Harnessing-for-Efficient-SQL-Synthesis.pdf,,arXiv(abs/pdf) route-supplement-20260303
arXiv,NL2SQL,2024,2411.07763v2,Spider 2.0: Evaluating Language Models on Real-World Enterprise Text-to-SQL Workflows,https://arxiv.org/abs/2411.07763v2,https://arxiv.org/pdf/2411.07763v2,https://arxiv.org/pdf/2411.07763v2,downloaded,papers/arxiv/058-2411.07763v2-Spider-20-Evaluating-Language-Models-on-Real-World-Enterprise-Text-to-SQL-Workflows.pdf,,arXiv(abs/pdf) route-supplement-20260303
arXiv,NL2SQL,2025,2502.00675v1,"ReFoRCE: A Text-to-SQL Agent with Self-Refinement, Format Restriction, and Column Exploration",https://arxiv.org/abs/2502.00675v1,https://arxiv.org/pdf/2502.00675v1,https://arxiv.org/pdf/2502.00675v1,downloaded,papers/arxiv/059-2502.00675v1-ReFoRCE-A-Text-to-SQL-Agent-with-Self-Refinement-Format-Restriction-and-Column-Explorati.pdf,,arXiv(abs/pdf) route-supplement-20260303
arXiv,NL2SQL,2026,2601.10318v1,Boundary-Aware NL2SQL: Integrating Reliability through Hybrid Reward and Data Synthesis,https://arxiv.org/abs/2601.10318v1,https://arxiv.org/pdf/2601.10318v1,https://arxiv.org/pdf/2601.10318v1,downloaded,papers/arxiv/060-2601.10318v1-Boundary-Aware-NL2SQL-Integrating-Reliability-through-Hybrid-Reward-and-Data-Synthesis.pdf,,arXiv(abs/pdf) route-supplement-20260303; note=user_specified_id_2505.07498_mismatch_corrected
arXiv,NL2SQL,2023,2308.15363v4,Text-to-SQL Empowered by Large Language Models: A Benchmark Evaluation,https://arxiv.org/abs/2308.15363v4,https://arxiv.org/pdf/2308.15363v4,https://arxiv.org/pdf/2308.15363v4,downloaded,papers/arxiv/061-2308.15363v4-Text-to-SQL-Empowered-by-Large-Language-Models-A-Benchmark-Evaluation.pdf,,arXiv(abs/pdf) route-supplement-20260303
arXiv,NL2SQL,2022,2204.00498v1,Evaluating the Text-to-SQL Capabilities of Large Language Models,https://arxiv.org/abs/2204.00498v1,https://arxiv.org/pdf/2204.00498v1,https://arxiv.org/pdf/2204.00498v1,downloaded,papers/arxiv/062-2204.00498v1-Evaluating-the-Text-to-SQL-Capabilities-of-Large-Language-Models.pdf,,arXiv(abs/pdf) route-supplement-20260303; baseline_exception=true
